<?xml version="1.0" encoding="Windows-1251"?>
<!-- edited with XML Spy v3.5 NT (http://www.xmlspy.com) by alakim (mai) -->
<!DOCTYPE chapter SYSTEM "chapter.dtd">
<?xml-stylesheet type="text/xsl" href="chapter.xsl" ?>
<chapter part="3" chapt="9" verse_cnt="10">
	<title>ГлавA девsтаz</title>
	<inscription>Њ є4же возбуждaти себE всегдA ко ўсeрдствованію и3 теплотЁ гDней.</inscription>
	<verse number="№">Пріиди2, q человёче! и3 ви1ждь: пріиди2, гDа своего2 прослaви, пріиди2, гDа своего2 восп0й, пріиди2, припади2 пред8 гDемъ, и3 восплaчисz пред8 сотв0ршимъ тS <ref>Pал0мъ §д</ref>: пріиди2, припади2, и3 и3сповёждьсz пресвzт0му є3гw2 и4мени: вкуси2, и3 ўвёждь ћкw бlгъ гDь <ref>Pал0мъ lг</ref>, п0й и4мени є3гw2, ћкw добро2.</verse>
	<verse number="в7">Пріиди2 ѓлчущій и3 жaждущій2, насhтисz бжcтвенныz пи1щи пріиди2 њмрачeнный, наслади1сz присносyщнагw свёта: пріиди1 во ќзахъ сhй, наслади1сz своб0ды: пріиди2 смeртный, прилэпи1сz безсмeртному, да вёчныz смeрти и3збyдеши, и3 животA2 вёчнагw спод0бишисz.</verse>
	<verse number="G">Пріиди2 ск0рбный и3 печaльный, наслади1сz пrносyщныz рaдости: пріиди2 ўнhлый и3 њкаменeнный, да разжeшисz ћкw џгнь: пріиди2 ни1щій, да њбогати1шисz вёчнымъ богaтствомъ: пріиди2 наги1й, да њблечeшисz безсмeртною слaвою, и3 њдёешисz ћкw ри1зою свётомъ благодaти гDни.</verse>
	<verse number="д7">Воспрzни2, воспрzни2, q человёче! и3 и3стрезви1сz, воспрzни2 и3 припади2 ко гDу бGу сотв0ршему тS. возставлsй своS ч{вства, и3 возжизaй свэти1льникъ сeрдца твоегw2, да не когдA въ тебЁ ўгaснетъ, и3 њстaвитъ тS во тмЁ нечyвствіz.</verse>
	<verse number="є7">Развeрзи, развeрзи, q человёче! дyшу на пріsтіе гDа слaвы: сe бо судіS стои1тъ при двeрехъ твоегw2 с®ца, и3 толчeтъ, ћкw да tвeрзеши є3мY, и3 вни1детъ къ тебЁ, и3 ћстъ съ тоб0ю, и3 пребyдетъ съ душeю твоeю во вёки вэкHвъ, никогдA t тебE tлучazсz.</verse>
	<verse number="ѕ7">Возставлsй ќбw человёче, возставлsй вс‰ сво‰ ч{вства, воспрzни2 не лэнsщисz и3 не ўнывaющи, не пощади2 пл0ти, не пощади2 души2, да вэнцeмъ нетлёніz ўвzзeшисz. Возводи2 џчи твои2 къ бGу, и3 ўви1ждь є3гw2 блaгость, и3 всE є4же њ тебЁ тaинство. </verse>
	<verse number="з7">Не презирaй дaннагw ти2 врeмене на стzжaніе вёчныхъ бл†гъ: сe бо грzдeтъ гDь ск0рw на џблацэхъ, со слaвою и3 си1лою мн0гою, воздaти комyждо по дэлHмъ є3гw2, и3 ќзритъ є3го2 всsко џко, и3 и5же є3го2 пробод0ша, и3 плaчь сотворsтъ на сS њ нeмъ всS колBна земнaz: сE пріи1детъ ск0рw <ref>Ґпокaл: гл+а №</ref>. Блажeнъ соблюдazй зaпwвэди гDни, блажeнъ хранsй є3гw2 зaпwвэди: пріи1детъ бо, пріи1детъ и3 не ўмeдлитъ.</verse>
	<verse number="}">Возводи2, возводи2 ќмныz џчи сeрдца твоегw2 къ бGу, q человёче и3 разжизaй своE сeрдце къ бжcтвенной є3гw2 любви2, возбуждaй свою2 дyшу къ б9eственному є3гw2 желaнію, вопjй безпрестaни къ бGу, под0бzсz слэпцY: сн7е дв7довъ, сн7е б9ій поми1луй мS, ўщeдри мS, вразуми1 мz, научи1 мz в0ли твоеS с™hz, зaповэдей твои1хъ, и3 жи1въ бyду.</verse>
	<verse number="f7">Въ бз7э всE желaніе своE и3 похотёніе да и4маши, въ бз7э всE ўповaніе и3 надeжду да полагaеши, тaмw вeсь да пасeшисz, тaмw весь всегдA да пребывaеши, до негHже концA сотворeнъ є3си2, тaмw да спэши1шисz дeнь и3 н0щь, ни мaла даS себЁ пок0z и3 њпочивaніz, д0ндеже получи1ши и3ск0мое, д0ндеже њбрsщеши мёсто гDви, селeніе бGу їaкwвлю <ref>Pал0мъ рlа</ref>.</verse>
	<verse number="‹">Да ничт0же тS tт0ргнетъ, да ничт0же ти2 препнeтъ, да ничт0же ти2 возбрани1тъ, да ничт0же тS tсэчeтъ t гDни любвE и3 бжcтвеннагw є3гw2 желaніz, ни ск0рбь, ни тэснотA, ни глaдъ, ни гонeніе, ни џгнь, ни мeчь: т0й бо є4сть тв0й жив0тъ. То2й твоE є4сть спасeніе, то2й твоS рaдость и3 весeліе, и3 присносyщное наслаждeніе и3 вёчный пок0й.</verse>
</chapter>

