<?xml version="1.0" encoding="Windows-1251"?>
<!-- edited with XML Spy v3.5 NT (http://www.xmlspy.com) by alakim (mai) -->
<!DOCTYPE verses SYSTEM "chapter.dtd">
<?xml-stylesheet type="text/xsl" href="chapter.xsl" ?>
<verses nr="1" verse_cnt="10">
	<title>СтіхослоHвіz пє1рваz,</title>
	<subtitle>любeзнагw къ бGу взывaніz.</subtitle>
	<verse number="№">Возлюблю1 тz, гDи, крёпосте моS: гDь ўтверждeніе моE, и3 прибёжище моE, и3 и3збaвитель м0й, бGъ м0й, пом0щникъ м01й, и3 ўповaю на него2: защи1титель м0й, и3 р0гъ спасeніz моегw2, и3 застyпникъ мо2й. ХвалS призовY гDа, и3 t вр†гъ мои1хъ спасyсz <ref>Pал0мъ з7i</ref>.</verse>
	<verse number="в7">К0ль возлю1блєнна селє1ніz твоS, гDи си1лъ; Желaетъ и скончавaетсz душA моS во дворы2 гDни: с®це моE и3 пл0ть моS возрaдовасz њ бз7э жи1вэ <ref>Pал0мъ п7г</ref>. Бlжeни живyщіи въ домY твоeмъ: въ вёки вэкHвъ восхвaлzтъ тS. Лyчше дeнь є3ди1нъ во дв0рэхъ твои1хъ, гDи, пaче тhсzщъ: и3зв0лихъ приметaтисz въ домY бGа моегw2 пaче, нeже жи1ти ми2 въ селeніихъ грёшничихъ <ref>Pал0мъ п7г</ref>.</verse>
	<verse number="G">К0ль возлюби1хъ зак0нъ тв0й, гDи; вeсь дeнь поучeніе моE є4сть. К0ль сладкA гортaни моемY словесA твоS, пaче мeда ўстHмъ мои1мъ; сегw2 рaди возненави1дэхъ всsкъ пyть непрaвды. Свэти1льникъ ногaма мои1ма зак0нъ тв0й, и3 свётъ стезsмъ мои1мъ. Њправд†ніz твоS вожделённа сyть, гDи, пaче злaта и3 кaмене чeстна мн0га, и3 слaждша пaче мeда и3 с0та <ref>Pал0мъ р}i</ref>.</verse>
	<verse number="д7">К0ль блaгъ бGъ Ї}левъ, пр†вымъ сeрдцемъ <ref>Pал0мъ o7в</ref>; К0ль мн0гое мн0жество блaгости твоеS гDи, ю4же скрhлъ є3си2 боsщымсz тебE; содёлалъ є3си2 ўповaющымъ на тS пред8 сhны чlвёческими; Скрhеши и5хъ въ тaйнэ лицA твоегw2 t мzтeжа человёческа <ref>Pал0мъ l</ref>. Nбaче бGови повини1сz, душE моS, ћкw t тогw2 терпёніе моE: и1бо т0й бGъ м0й и3 сп7съ м0й, застyпникъ м0й: не подви1жусz во вёкъ <ref>Pал0мъ …а</ref>.</verse>
	<verse number="є7">Њ бз7э спасeніе моE, и3 слaва моS. БGъ п0мощи моеS, и3 ўповaніе моE на бGа. Ўповaйте на него2 вeсь с0нмъ людeй: и3зліsйте пред8 ни1мъ сердцA вaша: ћкw бGъ пом0щникъ нaшъ є4сть. Не ўповaйте на непрaвду, и3 на восхищeніе не желaйте: богaтство ѓще течeтъ, не прилагaйте сeрдца. Е#ди1ною гlа бGъ, дв0z сі‰ слhшахъ, занE держaва б9іz, и3 твоS, гDи, млcть: ћкw ты2 воздaси комyждо по дэлHмъ є3гw2 <ref>Pал0мъ …а</ref>.</verse>
	<verse number="ѕ7">Б9е, б9е м0й, къ тебэ ќтренюю: возжадA тебE душA моS, к0ль мн0жицею тебЁ пл0ть моS, въ земли2 пyстэ и3 непрох0днэ и3 безв0днэ: тaкw во с™ёмъ kви1хсz тебЁ, ви1дэти си1лу твою2 и3 слaву твою2. Ћкw лyчши ми1лость твоS па паче живHтъ: ўстнЁ мои2 похвали1тэ тS, тaкw благословлю2 тz въ животЁ моeмъ: њ и4мени твоeмъ воздэжY рyцэ мои2. ПрильпE душA моS по тебЁ, менe же пріsтъ десни1ца твоS <ref>Pал0мъ …в</ref>.</verse>
	<verse number="з7">И$мже џбразомъ желaетъ є3лeнь на и3ст0чники воднhz, си1це желaетъ душA моS къ тебЁ, б9е. ВозжадA душA моS къ бGу крёпкому жив0му: когдA пріидY и3 kвлю1сz лицY б9ію; мlтва бGу животA моегw2. РекY бGу: застyпникъ м0й є3си2, почт0 мz забhлъ є3си2; и3 вскyю сётуz хождY, внегдA њскорблsетъ врaгъ <ref>Pал0мъ м7а</ref>;</verse>
	<verse number="}">ГDь просвэщeніе моE и3 сп7си1тель м0й, когw2 ўбою1сz; гDь защи1титель животA моегw2, t когw2 ўстрашyсz; Е#ди1но проси1хъ t гDа, то2 взыщY: є4же жи1ти ми2 въ домY гDни всS дни2 животA моегw2, зрёти ми2 красотY гDню, и3 посэщaти хрaмъ с™hй є3гw2. ВзыскA тебE лицE моE, лицA твоегw2 гDи взышY <ref>Pал0мъ к7ѕ</ref>.</verse>
	<verse number="f7">Гот0во с®це моE, б9е, гот0во с®це моE: воспою2 и3 пою2 во слaвэ моeй. Востaни слaва моS, востaни pалти1рю и3 гyсли, востaну рaнw. И#сповёмсz тебЁ въ лю1дехъ гDи, пою2 тебЁ во kзhцэхъ. Ћкw вeліz верхY нб7съ ми1лость твоS, и3 до џблакъ и4стина твоS. Вознеси1сz на нб7сA, б9е, и3 по всeй земли2 слaва твоS <ref>Pал0мъ Rз</ref>.</verse>
	<verse number="‹">Ты2 є3си2 б9е, держaва моS, разжзи2 ўтрHбы моS и3 сeрдце моE. Ћкw ми1лость твоS пред8 nчи1ма мои1ма є4сть <ref>Pал0мъ к7є</ref>. Посли2 свётъ тв0й и3 и4стину твою2, тa мz настaвиста, и3 введ0ста мS въ г0ру с™yю твою2, и3 въ селє1ніz твоS. И# вни1ду къ жeртвеннику б9ію, къ бGу веселsщему ю4ность мою2: и3сповёмсz тебЁ въ гyслехъ б9е, б9е м0й. Вскyю приск0рбна є3си2 душE моS; и3 вскyю смущaеши мS; ўповaй на бGа, ћкw и3сповёмсz є3мY, спасeніе лицA моегw2, и3 бGъ м0й <ref>Pал0мъ м7в</ref>.</verse>
</verses>
